{
  "$schema": "http://json-schema.org/draft-07/schema#",
  "$id": "https://schemas.linxin666.org/dsh-pet/pet-manifest-v2.schema.json",
  "title": "DSH Pet Manifest v2",
  "description": "Pet-center manifest v2 (issue #623). Pure-asset pet directory contract: renderer type declaration, license metadata, and renderer-specific blocks. Top level and renderer blocks are fail-closed; v1 manifests (no petManifestVersion) are compat-read as sprite2d by the registry.",
  "type": "object",
  "required": [
    "petManifestVersion",
    "id",
    "displayName",
    "license"
  ],
  "additionalProperties": false,
  "properties": {
    "$schema": {
      "type": "string"
    },
    "petManifestVersion": {
      "const": 2
    },
    "id": {
      "type": "string",
      "pattern": "^[a-z0-9][a-z0-9-]*$",
      "maxLength": 64,
      "description": "Globally unique lowercase kebab-case pet id."
    },
    "displayName": {
      "type": "string",
      "minLength": 1,
      "maxLength": 64
    },
    "description": {
      "type": "string",
      "maxLength": 500
    },
    "version": {
      "type": "string",
      "pattern": "^\\d+\\.\\d+\\.\\d+$"
    },
    "frameDensity": {
      "type": "integer",
      "minimum": 1,
      "maximum": 4,
      "description": "In-between drawings per baseline frame; preserves cycle speed under fixed/tok-s timing. Default 1."
    },
    "author": {
      "type": "string",
      "maxLength": 128
    },
    "license": {
      "type": "string",
      "minLength": 1,
      "maxLength": 128,
      "description": "Asset license identifier (SPDX id or free text). Required so community pets always carry provenance."
    },
    "homepage": {
      "type": "string",
      "maxLength": 500,
      "description": "Optional provenance URL for the pet assets."
    },
    "renderer": {
      "enum": [
        "sprite2d",
        "live2d",
        "frames2d"
      ],
      "default": "sprite2d",
      "description": "Renderer kind; omitted means sprite2d (v1 compatibility). Unknown values are rejected."
    },
    "sprite2d": {
      "type": "object",
      "additionalProperties": false,
      "required": [
        "spritesheetPath"
      ],
      "description": "Spritesheet renderer block; required when renderer=sprite2d.",
      "properties": {
        "spritesheetPath": {
          "type": "string",
          "minLength": 1,
          "description": "Atlas path relative to the manifest directory (safe segments only)."
        },
        "cell": {
          "type": "object",
          "additionalProperties": false,
          "description": "Atlas cell size in px; defaults to the Codex contract 192x208.",
          "properties": {
            "width": {
              "type": "integer",
              "minimum": 1,
              "maximum": 2048
            },
            "height": {
              "type": "integer",
              "minimum": 1,
              "maximum": 2048
            }
          }
        },
        "columns": {
          "type": "integer",
          "minimum": 1,
          "maximum": 32,
          "default": 8
        },
        "atlasRows": {
          "type": "integer",
          "minimum": 1,
          "maximum": 32,
          "description": "Total atlas rows; 9 for the classic contract, 11 for v2 look-row atlases."
        },
        "frames": {
          "type": "array",
          "maxItems": 32,
          "items": {
            "type": "integer",
            "minimum": 0,
            "maximum": 32
          },
          "description": "Per-row used frame counts; omitted rows fall back to the hatch-pet contract table."
        },
        "tracks": {
          "type": "object",
          "description": "Per-track rhythm overrides (durations/loop/fallback), v1 structure unchanged."
        }
      }
    },
    "live2d": {
      "type": "object",
      "additionalProperties": false,
      "required": [
        "model",
        "motions"
      ],
      "description": "Live2D renderer block; required when renderer=live2d. The Cubism Core runtime is always user-supplied; the plugin never bundles or downloads it.",
      "properties": {
        "model": {
          "type": "string",
          "minLength": 1,
          "pattern": "\\.model3\\.json$",
          "description": "Path of the .model3.json relative to the manifest directory."
        },
        "scale": {
          "type": "number",
          "exclusiveMinimum": 0,
          "maximum": 10,
          "default": 1
        },
        "translate": {
          "type": "object",
          "additionalProperties": false,
          "properties": {
            "x": {
              "type": "number"
            },
            "y": {
              "type": "number"
            }
          }
        },
        "motions": {
          "type": "object",
          "additionalProperties": false,
          "required": [
            "idle"
          ],
          "description": "ActivityPhase -> model motion group name. Unmapped phases fall back to the idle group; missing groups degrade to the first frame with a diagnostic.",
          "properties": {
            "idle": {
              "type": "string",
              "minLength": 1
            },
            "waiting": {
              "type": "string",
              "minLength": 1
            },
            "thinking": {
              "type": "string",
              "minLength": 1
            },
            "tool": {
              "type": "string",
              "minLength": 1
            },
            "review": {
              "type": "string",
              "minLength": 1
            },
            "done": {
              "type": "string",
              "minLength": 1
            },
            "failed": {
              "type": "string",
              "minLength": 1
            }
          }
        },
        "expressions": {
          "type": "object",
          "additionalProperties": false,
          "description": "Optional ActivityPhase -> expression name (layered over the motion).",
          "properties": {
            "idle": {
              "type": "string",
              "minLength": 1
            },
            "waiting": {
              "type": "string",
              "minLength": 1
            },
            "thinking": {
              "type": "string",
              "minLength": 1
            },
            "tool": {
              "type": "string",
              "minLength": 1
            },
            "review": {
              "type": "string",
              "minLength": 1
            },
            "done": {
              "type": "string",
              "minLength": 1
            },
            "failed": {
              "type": "string",
              "minLength": 1
            }
          }
        },
        "hitAreas": {
          "type": "array",
          "items": {
            "type": "string",
            "minLength": 1
          },
          "description": "Hit area names that trigger pet.interact; defaults to every HitArea the model declares."
        },
        "lipSync": {
          "type": "boolean",
          "default": false,
          "description": "Optional whisper-paced lip sync (post-M3)."
        }
      }
    },
    "frames2d": {
      "type": "object",
      "additionalProperties": false,
      "required": [
        "tracks",
        "phases"
      ],
      "description": "Frame-sequence renderer block; required when renderer=frames2d. Free-form named tracks laid out as <dir>/<track>/<frame>.(webp|png|gif|jpg|jpeg); phase-direct state selection (the live2d motions precedent). Frame durations resolve frameMs[i] > filename-encoded <base>_<index>_<ms> suffix > defaultFrameMs.",
      "properties": {
        "dir": {
          "type": "string",
          "minLength": 1,
          "default": ".",
          "description": "Frame root directory relative to the manifest directory (safe segments only)."
        },
        "defaultFrameMs": {
          "type": "integer",
          "minimum": 16,
          "maximum": 5000,
          "default": 200
        },
        "tracks": {
          "type": "object",
          "minProperties": 1,
          "maxProperties": 64,
          "description": "Named tracks (lowercase kebab ids, at most 32 chars).",
          "additionalProperties": {
            "type": "object",
            "additionalProperties": false,
            "properties": {
              "frames": {
                "type": "array",
                "minItems": 1,
                "maxItems": 64,
                "items": {
                  "type": "string",
                  "minLength": 1,
                  "description": "Frame file name inside the track directory (no path segments)."
                },
                "description": "Explicit ordered frame list; omitted means list the track directory in filename order."
              },
              "frameMs": {
                "type": "array",
                "minItems": 1,
                "items": {
                  "type": "integer",
                  "minimum": 16,
                  "maximum": 5000
                },
                "description": "Per-frame durations; requires an explicit frames list of the same length."
              },
              "loop": {
                "type": "boolean",
                "default": true,
                "description": "false stops on the last frame, then enters fallback."
              },
              "fallback": {
                "type": "string",
                "description": "Track entered when a non-loop track ends; defaults to the idle-mapped track."
              }
            }
          }
        },
        "phases": {
          "type": "object",
          "additionalProperties": false,
          "required": [
            "idle"
          ],
          "description": "ActivityPhase -> track name; idle is required, unmapped phases fall back to it.",
          "properties": {
            "idle": { "type": "string", "minLength": 1 },
            "waiting": { "type": "string", "minLength": 1 },
            "thinking": { "type": "string", "minLength": 1 },
            "tool": { "type": "string", "minLength": 1 },
            "review": { "type": "string", "minLength": 1 },
            "done": { "type": "string", "minLength": 1 },
            "failed": { "type": "string", "minLength": 1 }
          }
        },
        "skins": {
          "type": "array",
          "minItems": 1,
          "maxItems": 16,
          "description": "Optional selectable skins: each swaps the base idle target (idle phase, unmapped phases and every fallback back to idle) to its own looping idle track. Gameplay tracks (shy/work/sleep...) are not replaced.",
          "items": {
            "type": "object",
            "additionalProperties": false,
            "required": [
              "id",
              "label",
              "idleTrack"
            ],
            "properties": {
              "id": {
                "type": "string",
                "minLength": 1,
                "maxLength": 24,
                "pattern": "^[a-z0-9][a-z0-9-]*$",
                "description": "Lowercase kebab skin id."
              },
              "label": {
                "type": "string",
                "minLength": 1,
                "maxLength": 40,
                "description": "User-facing skin name."
              },
              "idleTrack": {
                "type": "string",
                "minLength": 1,
                "description": "A declared looping track that becomes the base idle while selected."
              },
              "clickActions": {
                "type": "array",
                "minItems": 1,
                "maxItems": 8,
                "description": "Optional click-triggered actions exclusive to this skin: while selected, a tap rolls each action by probability (in order) and plays its track once if hit; misses fall through to the regular touch zones.",
                "items": {
                  "type": "object",
                  "additionalProperties": false,
                  "required": [
                    "track",
                    "probability"
                  ],
                  "properties": {
                    "track": {
                      "type": "string",
                      "minLength": 1,
                      "description": "A declared track played once on hit (usually non-looping)."
                    },
                    "probability": {
                      "type": "number",
                      "exclusiveMinimum": 0,
                      "maximum": 1,
                      "description": "Hit probability for this action."
                    },
                    "phrases": {
                      "type": "array",
                      "minItems": 1,
                      "maxItems": 5,
                      "items": {
                        "type": "string",
                        "minLength": 1,
                        "maxLength": 120
                      },
                      "description": "Optional lines spoken when the action fires."
                    }
                  }
                }
              },
              "gameplayTracks": {
                "type": "object",
                "minProperties": 1,
                "maxProperties": 8,
                "description": "Optional gameplay-state overrides: gameplay state name (e.g. 'sleep' or 'work') -> a declared frames2d track swapped in while this skin is selected (e.g. a skin variant of the sleep loop).",
                "additionalProperties": {
                  "type": "string",
                  "minLength": 1,
                  "description": "A declared frames2d track."
                }
              }
            }
          }
        }
      }
    },
    "sequences": {
      "type": "object",
      "description": "Renderer-agnostic ActivityPhase sequence table (v1 structure; every declared sequence has at least 5 items)."
    },
    "remarks": {
      "type": "object",
      "description": "Per-slot witty-remark pools (v1 structure; a slot replaces the built-in pool for that slot only)."
    },
    "gameplay": {
      "type": "object",
      "description": "Optional gameplay layer (frames2d pets only): stat decay, currencies, touch zones, work/sleep loops, passive income and a shop with optional lotteries. State references name frames2d tracks; structure is fail-closed in the validator."
    }
  },
  "allOf": [
    {
      "if": {
        "properties": {
          "renderer": {
            "const": "sprite2d"
          }
        }
      },
      "then": {
        "required": [
          "sprite2d"
        ]
      }
    },
    {
      "if": {
        "properties": {
          "renderer": {
            "const": "live2d"
          }
        }
      },
      "then": {
        "required": [
          "live2d"
        ]
      }
    },
    {
      "if": {
        "properties": {
          "renderer": {
            "const": "frames2d"
          }
        }
      },
      "then": {
        "required": [
          "frames2d"
        ]
      }
    }
  ]
}
