{
  "petManifestVersion": 2,
  "id": "blue-whale-business",
  "displayName": "小蓝鲸（商务版）",
  "version": "1.3.0",
  "author": "ltmroberthk915 · AI-assisted artwork",
  "license": "MIT",
  "renderer": "sprite2d",
  "description": "商务小蓝鲸：完整轮廓与安全留白，尾鳍上下摆动、胸鳍配合划水的八帧游泳循环，九种加密动作。",
  "sprite2d": {
    "spritesheetPath": "spritesheet.webp",
    "cell": {
      "width": 192,
      "height": 128
    },
    "columns": 8,
    "frames": [
      8,
      8,
      8,
      8,
      8,
      8,
      8,
      8,
      8
    ],
    "tracks": {
      "idle": {
        "durations": [
          450,
          450,
          150,
          150,
          175,
          175,
          175,
          175
        ],
        "loop": true
      },
      "running-right": {
        "durations": [
          150,
          150,
          150,
          150,
          150,
          150,
          150,
          150
        ],
        "loop": true
      },
      "running-left": {
        "durations": [
          150,
          150,
          150,
          150,
          150,
          150,
          150,
          150
        ],
        "loop": true
      },
      "waving": {
        "durations": [
          150,
          150,
          175,
          175,
          175,
          175,
          200,
          200
        ],
        "loop": true
      },
      "jumping": {
        "durations": [
          125,
          125,
          150,
          150,
          175,
          175,
          200,
          200
        ],
        "loop": false,
        "fallback": "idle"
      },
      "failed": {
        "durations": [
          125,
          125,
          150,
          150,
          175,
          175,
          200,
          200
        ],
        "loop": false,
        "fallback": "idle"
      },
      "waiting": {
        "durations": [
          150,
          150,
          150,
          150,
          150,
          150,
          150,
          150
        ],
        "loop": true
      },
      "running": {
        "durations": [
          150,
          150,
          150,
          150,
          150,
          150,
          150,
          150
        ],
        "loop": true
      },
      "review": {
        "durations": [
          150,
          150,
          150,
          150,
          150,
          150,
          150,
          150
        ],
        "loop": true
      }
    }
  },
  "frameDensity": 2
}
