{
  "petManifestVersion": 2,
  "id": "whale-girl-refined",
  "displayName": "鲸鱼娘（精致版）",
  "renderer": "sprite2d",
  "sprite2d": {
    "spritesheetPath": "spritesheet.webp",
    "frames": [
      16,
      8,
      8,
      14,
      16,
      16,
      16,
      16,
      16
    ],
    "tracks": {
      "idle": {
        "durations": [
          520,
          180,
          180,
          180,
          180,
          180,
          65,
          65,
          65,
          65,
          180,
          180,
          180,
          180,
          180,
          520
        ]
      },
      "running-right": {
        "durations": [
          300,
          300,
          300,
          300,
          300,
          300,
          300,
          400
        ]
      },
      "running-left": {
        "durations": [
          300,
          300,
          300,
          300,
          300,
          300,
          300,
          400
        ]
      },
      "waving": {
        "durations": [
          150,
          115,
          115,
          115,
          115,
          115,
          115,
          115,
          115,
          115,
          115,
          115,
          115,
          180
        ]
      },
      "jumping": {
        "durations": [
          120,
          100,
          90,
          90,
          90,
          110,
          100,
          90,
          90,
          90,
          100,
          110,
          90,
          100,
          110,
          150
        ]
      },
      "failed": {
        "durations": [
          200,
          130,
          130,
          130,
          130,
          130,
          130,
          240,
          130,
          130,
          130,
          130,
          130,
          130,
          180,
          180
        ]
      },
      "waiting": {
        "durations": [
          150,
          150,
          150,
          150,
          150,
          150,
          150,
          150,
          150,
          150,
          150,
          150,
          150,
          150,
          150,
          150
        ]
      },
      "running": {
        "durations": [
          230,
          160,
          150,
          150,
          80,
          80,
          65,
          65,
          65,
          80,
          150,
          150,
          150,
          150,
          150,
          230
        ]
      },
      "review": {
        "durations": [
          170,
          170,
          170,
          170,
          170,
          170,
          170,
          170,
          170,
          170,
          170,
          170,
          170,
          170,
          170,
          170
        ]
      }
    },
    "columns": 16,
    "cell": {
      "width": 192,
      "height": 208
    }
  },
  "description": "基于鲸鱼娘形象进行 AI 辅助二次创作、修复与细节精修的内置变体。",
  "license": "MIT",
  "sequences": {
    "idle": [
      "idle",
      "running",
      "idle",
      "running",
      "idle"
    ]
  }
}
